{
  "contract_version": 1,
  "profile_id": "plan.read-only.v1",
  "profile_version": 1,
  "mode": "plan",
  "enabled": true,
  "implementation_state": "implemented",
  "executor": "countyforge_runner.executor.plan",
  "permitted_providers": [
    "openai",
    "sakana"
  ],
  "permitted_model_refs": [
    "openai.gpt-5.6",
    "sakana.fugu",
    "sakana.fugu-ultra"
  ],
  "reasoning_efforts": [
    "medium",
    "high",
    "xhigh"
  ],
  "default_reasoning_effort": "high",
  "maximum_reasoning_effort": "xhigh",
  "minimum_codex_cli_version": "0.144.0",
  "prompt": {
    "id": "countyforge-plan",
    "version": 1,
    "path": ".ai/prompts/countyforge-plan.v1.md"
  },
  "output_schema": "countyforge-plan-result.schema.json",
  "generation_schema": "countyforge-plan-generation.schema.json",
  "allowed_artifacts": [
    "countyforge-plan-result.json",
    "countyforge-plan-events.ndjson",
    "countyforge-plan.stderr",
    "container.provenance.json",
    "countyforge-planning-packet.json",
    "countyforge-context-manifest.json",
    "countyforge-request.provenance.json",
    "countyforge-profile.snapshot.json",
    "countyforge-run-event.ndjson",
    "countyforge-run-summary.json",
    "countyforge-run-metrics.prom"
  ],
  "input_policy": {
    "approved_roots": [
      ".ai/contexts"
    ],
    "resolve_symlinks": true,
    "require_regular_files": true,
    "packet_provenance_schema": "countyforge-planning-context-manifest.schema.json"
  },
  "repository_policy": {
    "expected_full_name": "TruPryce/property-tax-data-platform",
    "remote_name": "origin",
    "verify_head": true,
    "base_policy": "ancestor_of_head"
  },
  "budgets": {
    "defaults": {
      "wall_clock_seconds": 1800,
      "attempts": 1,
      "max_output_bytes": 524288,
      "max_input_bytes": 5000000,
      "max_tokens": null,
      "max_cost_usd": null
    },
    "ceilings": {
      "wall_clock_seconds": 3600,
      "attempts": 2,
      "max_output_bytes": 1048576,
      "max_input_bytes": 10000000,
      "max_tokens": 1000000,
      "max_cost_usd": 100.0
    }
  },
  "filesystem_mounts": [
    {
      "source": "schema_directory",
      "target": "/workspace/.ai/schemas",
      "access": "read_only"
    },
    {
      "source": "frozen_planning_packet",
      "target": "/workspace/packet.json",
      "access": "read_only"
    },
    {
      "source": "frozen_context_manifest",
      "target": "/workspace/manifest.json",
      "access": "read_only"
    },
    {
      "source": "claimed_output_directory",
      "target": "/out",
      "access": "read_write"
    }
  ],
  "repository_access": "none",
  "writable_paths": [
    "/out"
  ],
  "model_tools": [],
  "deterministic_commands": [],
  "network": {
    "policy": "provider_only",
    "destinations": [
      "selected_provider_api"
    ]
  },
  "credential_names": [
    "OPENAI_API_KEY",
    "SAKANA_API_KEY"
  ],
  "host_credential_broker_names": [],
  "environment_allowlist": [
    "PATH",
    "HOME",
    "TMPDIR",
    "OPENAI_API_KEY",
    "SAKANA_API_KEY"
  ],
  "container": {
    "image": "countyforge-plan-agent:v1",
    "provider_images": {
      "openai": "countyforge-plan-agent-openai:v1",
      "sakana": "countyforge-plan-agent-sakana:v1"
    },
    "availability": "available",
    "configuration_bundle": "plan-read-only-v1",
    "codex_cli_version": "0.144.6"
  },
  "expected_security_posture": {
    "read_only_rootfs": true,
    "non_root": true,
    "cap_drop_all": true,
    "no_new_privileges": true,
    "repository_mounted": false,
    "model_shell": false,
    "browser": false,
    "apps_or_mcp": false,
    "image_generation": false,
    "web_search": false,
    "production_credentials": false
  }
}
