{
  "contract_version": 1,
  "profile_id": "validate.deterministic.v1",
  "profile_version": 1,
  "mode": "validate",
  "enabled": true,
  "implementation_state": "not_implemented",
  "executor": null,
  "permitted_providers": [],
  "permitted_model_refs": [],
  "reasoning_efforts": ["none"],
  "default_reasoning_effort": "none",
  "maximum_reasoning_effort": "none",
  "minimum_codex_cli_version": null,
  "prompt": {"id": "countyforge-validate", "version": 1, "path": ".ai/prompts/countyforge-validate.v1.md"},
  "output_schema": "countyforge-validation-result.schema.json",
  "allowed_artifacts": ["countyforge-validation-result.json", "countyforge-request.provenance.json", "countyforge-profile.snapshot.json", "countyforge-run-event.ndjson", "countyforge-run-summary.json", "countyforge-run-metrics.prom"],
  "input_policy": {"approved_roots": [".ai/contexts"], "resolve_symlinks": true, "require_regular_files": true, "packet_provenance_schema": null},
  "repository_policy": {"expected_full_name": "TruPryce/property-tax-data-platform", "remote_name": "origin", "verify_head": true, "base_policy": "ancestor_of_head"},
  "budgets": {"defaults": {"wall_clock_seconds": 1800, "attempts": 1, "max_output_bytes": 1048576, "max_input_bytes": 1000000, "max_tokens": null, "max_cost_usd": null}, "ceilings": {"wall_clock_seconds": 3600, "attempts": 1, "max_output_bytes": 4194304, "max_input_bytes": 2000000, "max_tokens": null, "max_cost_usd": null}},
  "filesystem_mounts": [{"source": "repository", "target": "/workspace", "access": "read_only"}, {"source": "claimed_output_directory", "target": "/out", "access": "read_write"}],
  "repository_access": "read_only",
  "writable_paths": ["/out"],
  "model_tools": [],
  "deterministic_commands": ["make check", "make runner-contract-tests", "make countyforge-runner-check", "make prepr-no-ai"],
  "network": {"policy": "disabled", "destinations": []},
  "credential_names": [],
  "host_credential_broker_names": [],
  "environment_allowlist": ["PATH", "HOME", "TMPDIR"],
  "container": {"image": null, "availability": "not_required", "configuration_bundle": "validate-deterministic-v1", "codex_cli_version": null},
  "expected_security_posture": {"read_only_rootfs": true, "non_root": true, "cap_drop_all": true, "no_new_privileges": true, "repository_mounted": true, "model_shell": false, "browser": false, "apps_or_mcp": false, "image_generation": false, "web_search": false, "production_credentials": false}
}
