{
  "contract_version": 1,
  "profile_id": "fix.targeted-write.v1",
  "profile_version": 1,
  "mode": "fix",
  "enabled": true,
  "implementation_state": "not_implemented",
  "executor": null,
  "permitted_providers": ["openai"],
  "permitted_model_refs": ["openai.gpt-5.6"],
  "reasoning_efforts": ["high", "xhigh"],
  "default_reasoning_effort": "xhigh",
  "maximum_reasoning_effort": "xhigh",
  "minimum_codex_cli_version": "0.144.0",
  "prompt": {"id": "countyforge-fix", "version": 1, "path": ".ai/prompts/countyforge-fix.v1.md"},
  "output_schema": "countyforge-fix-result.schema.json",
  "allowed_artifacts": ["countyforge-fix-result.json", "countyforge-request.provenance.json", "countyforge-profile.snapshot.json", "countyforge-run-event.ndjson", "countyforge-run-summary.json", "countyforge-run-metrics.prom"],
  "input_policy": {"approved_roots": [".ai/contexts"], "resolve_symlinks": true, "require_regular_files": true, "packet_provenance_schema": null},
  "repository_policy": {"expected_full_name": "TruPryce/property-tax-data-platform", "remote_name": "origin", "verify_head": true, "base_policy": "ancestor_of_head"},
  "budgets": {"defaults": {"wall_clock_seconds": 2400, "attempts": 1, "max_output_bytes": 1048576, "max_input_bytes": 8000000, "max_tokens": null, "max_cost_usd": null}, "ceilings": {"wall_clock_seconds": 5400, "attempts": 2, "max_output_bytes": 4194304, "max_input_bytes": 16000000, "max_tokens": 1500000, "max_cost_usd": 150.0}},
  "filesystem_mounts": [{"source": "repository", "target": "/workspace", "access": "read_write"}, {"source": "claimed_output_directory", "target": "/out", "access": "read_write"}],
  "repository_access": "targeted_write",
  "writable_paths": ["/workspace", "/out"],
  "model_tools": ["shell_tool", "unified_exec"],
  "deterministic_commands": [],
  "network": {"policy": "disabled", "destinations": []},
  "credential_names": ["OPENAI_API_KEY"],
  "host_credential_broker_names": [],
  "environment_allowlist": ["PATH", "HOME", "TMPDIR", "OPENAI_API_KEY"],
  "container": {"image": "countyforge-fix-agent:v1", "availability": "not_built", "configuration_bundle": "fix-targeted-write-v1", "codex_cli_version": "0.144.6"},
  "expected_security_posture": {"read_only_rootfs": true, "non_root": true, "cap_drop_all": true, "no_new_privileges": true, "repository_mounted": true, "model_shell": true, "browser": false, "apps_or_mcp": false, "image_generation": false, "web_search": false, "production_credentials": false}
}
